DIMENSÃO,COMPONENTE,INDICADOR,ID,INDICADOR NEGATIVADO,ANO,FONTE,DESCRIÇÃO / CÁLCULO,UNIDADE,INTERPRETAÇÃO,
SANEAMENTO BÁSICO,RESÍDUOS SÓLIDOS,Taxa de recuperação de materiais recicláveis,ag_rs_1,,2024,SINISA,Recuperação de resíduos recicláveis secos e orgânicos em relação à quantidade total de resíduos coletada (indicador IRS3010).,% de resíduos,"Interpretação dos dados: Quanto maior o resultado da UF nesse indicador, maior é a taxa de recuperação de materiais recicláveis.",
ÁGUA,QUALIDADE DA ÁGUA,Conformidade microbiológica,ag_qa_2,NEGATIVADO,2025,SISÁGUA,Percentual de amostras com presença de coliformes totais (> 0 ou termos textuais positivos) por UF.,% de amostras,"Interpretação dos dados: Quanto maior o resultado da UF neste indicador, maior é o percentual de conformidade microbiológica.",
ÁGUA,QUALIDADE DA ÁGUA,Conformidade de cloro residual,ag_qa_1,NEGATIVADO,2025,SISÁGUA,"Percentual de amostras com cloro residual livre fora do intervalo regulamentar (0,2 - 0,5 mg / L) por UF.",% de amostras,"Interpretação dos dados: Quanto maior o resultado da UF neste indicador, maior é o percentual de conformidade de cloro residual.",
SANEAMENTO BÁSICO,ESGOTO,Cobertura do tratamento de esgoto coletado,ag_esg_3,NEGATIVADO,2024,SINISA,Percentual de volume de esgoto coletado e o volume tratado por UF.,% de esgoto tratado,"Interpretação dos dados: Quanto maior o resultado da UF neste indicador, melhor é a cobertura do tratamento de esgoto coletado.",
SANEAMENTO BÁSICO,ESGOTO,Percentual de atendimento total de esgoto,ag_esg_2,,2024,SINISA,Percentual da população total atendida por rede coletora de esgoto ou soluções individuais adequadas por UF.,% da população,"Interpretação dos dados: Quanto maior o resultado da UF neste indicador, maior é o percentual da população atendida por rede coletora de esgoto.",
SANEAMENTO BÁSICO,ESGOTO,Adequação do esgoto sanitário,ag_esg_1,NEGATIVADO,2024,IBGE/SIDRA,"Proporção de tipos esgotamento senitários que não sejam considerados ""outros tipos"" (alternativos ou precários) por UF.",% domicílios,"Interpretação dos dados: Quanto maior o resultado da UF neste indicador, melhor é a adequação do esgoto sanitário.",
ÁGUA,DISTRIBUIÇÃO DE ÁGUA,Acesso à rede geral de água,ag_dist_3,,2024,IBGE/SIDRA,Proporção de domicílios ligados à rede pública de abastecimento de água em relação ao universo total de domicílios recenseados na UF.,% de domicílios,"Interpretação dos dados: Quanto maior o resultado da UF nesse indicador, maior é o acesso à rede geral de água.",
ÁGUA,DISTRIBUIÇÃO DE ÁGUA,Taxa de distribuição rural,ag_dist_2_a,,2024,IBGE/SIDRA,Percentual de domicílios e moradores com ligação à rede geral de distribuição de água rural.,% de domicílios,"Interpretação dos dados: Quanto maior o resultado da UF nesse indicador, maior é a taxa de distribuição de água para áreas rurais.",
ÁGUA,DISTRIBUIÇÃO DE ÁGUA,Taxa de distribuição urbana,ag_dist_2_b,,2024,IBGE/SIDRA,Percentual de domicílios e moradorescom ligação à rede geral de distribuição de água urbana.,% de domicílios,"Interpretação dos dados: Quanto maior o resultado da UF nesse indicador, maior é a taxa de distribuição de água para áreas urbanas.",
ÁGUA,DISTRIBUIÇÃO DE ÁGUA,Eficiência da distribuição de água,ag_dist_1,NEGATIVADO,2024,SNIS,Percentual de águas não perdidas na distribuição por UF.,% perdas na distribuição,"Interpretação dos dados: Quanto maior o resultado da UF neste indicador, melhor a eficiência na distribuição de água.",